{
  "envelope_version": "1.0.0",
  "message_id": "01234567-89ab-7def-8123-456789abcdef",
  "timestamp": "2026-02-07T12:00:00Z",
  "sender": "validator",
  "recipient": "executor",
  "action": "fs.read",
  "action_version": "1.0.0",
  "payload": {
    "path": "data/sample.txt",
    "offset": 0,
    "length": 4096,
    "encoding": "utf-8"
  }
}
